<?xml version="1.0" encoding="UTF-8"?>
<xs:schema xmlns:xs="http://www.w3.org/2001/XMLSchema">
	<xs:element name="list">
		<xs:complexType>
			<xs:sequence>
				<xs:element name="spawnChanceGroup" maxOccurs="unbounded">
					<xs:complexType>
						<xs:sequence>
							<xs:element name="raid" maxOccurs="unbounded">
								<xs:complexType>
									<xs:attribute name="id" type="xs:int" />
									<xs:attribute name="maxDrops" type="xs:int"
										default="1" />
								</xs:complexType>
							</xs:element>
							<xs:sequence>
								<xs:element name="dropLists" maxOccurs="1">
									<xs:complexType>
										<xs:sequence>
											<xs:element name="item" maxOccurs="unbounded">
												<xs:complexType>
													<xs:attribute name="id" type="xs:int" />
													<xs:attribute name="min" type="xs:int" />
													<xs:attribute name="max" type="xs:int" />
													<xs:attribute name="chance" type="xs:int" />
													<xs:attribute name="minOccurs" type="xs:int"
														default="0" />
													<xs:attribute name="maxOccurs" type="xs:int"
														default="0" />
												</xs:complexType>
											</xs:element>
										</xs:sequence>
									</xs:complexType>
								</xs:element>
							</xs:sequence>
						</xs:sequence>
						<xs:attribute name="type" type="xs:string" />
						<xs:attribute name="groupChance" type="xs:int" />
					</xs:complexType>
				</xs:element>
			</xs:sequence>
		</xs:complexType>
	</xs:element>
</xs:schema>